{
  "placements": [
    {
      "component_id": "temp_sensor_01",
      "layer": "device",
      "device_ref": "temp_sensor_01"
    },
    {
      "component_id": "edge_gateway_01",
      "layer": "edge",
      "device_ref": "edge_gateway_01"
    },
    {
      "component_id": "cloud_server_01",
      "layer": "cloud",
      "device_ref": "cloud_server_01"
    }
  ],
  "transports": [
    {
      "link_id": "link_sensor_to_gateway",
      "protocol": "MQTT",
      "qos": "at_least_once"
    },
    {
      "link_id": "link_gateway_to_cloud",
      "protocol": "HTTP",
      "qos": "best_effort"
    }
  ],
  "endpoints": [
    {
      "link_id": "link_sensor_to_gateway",
      "from_endpoint": "mqtt://broker/publish/sensors/temp_sensor_01/data",
      "to_endpoint": "mqtt://broker/subscribe/sensors/temp_sensor_01/data"
    },
    {
      "link_id": "link_gateway_to_cloud",
      "from_endpoint": "mqtt://broker/subscribe/sensors/temp_sensor_01/data",
      "to_endpoint": "https://<SECRET_CLOUD_API>/ingest"
    }
  ],
  "deployment": {
    "orchestrator": "custom",
    "config": {}
  }
}